version,name,aa,ppg,srm,attenuation,temperature_range,description,alcohol_tolerance,flocculation
yeast,WY3944 Wyeast Belgian Witbier,,,,74,62ºF – 75ºF,"This versatile witbier yeast strain can be used in a variety of Belgian style ales. This strain produces a complex flavor profile dominated by spicy phenolics with low to moderate ester production. It is a great strain choice when you want a delicate clove profile not to be overshadowed by esters. It will ferment fairly dry with a slightly tart finish that compliments the use of oats, malted and unmalted wheat. This strain is a true top cropping yeast requiring full fermenter headspace of 33%.",11% - 12%,Medium
yeast,WY5112 Wyeast Brettanomyces Bruxellensis,,,,80,60ºF – 75ºF,"This strain of wild yeast was isolated from brewery cultures in the Brussels region of Belgium. It produces the classic “sweaty horse blanket” character of indigenous beers such as gueuze, lambics and sour browns and may form a pellicle in bottles or casks. The strain is generally used in conjunction with S. cerevisiae, as well as other wild yeast and lactic bacteria. At least 3-6 months aging is generally required for flavor to fully develop.",12%,Medium
yeast,WY5151PC Wyeast Brettanomyces Claussenii,,,,80,60ºF – 75ºF,"Isolated from English stock ale, this wild yeast produces a mild “Brett” character with overtones of tropical fruit and pineapple. B. clausenii can be used as a primary strain; however it is typically inoculated in conjunction with other yeasts and lactic acid bacteria. A pellicle may develop in bottles or casks during conditioning.",12%,Low
yeast,WY5335 Wyeast Lactobacillus Delbrueckii,,,,,60ºF – 95ºF,"Lactic acid bacteria isolated from a Belgian brewery. This culture produces moderate levels of acidity and is commonly found in many types of beers including gueuze, lambics, sour brown ales and Berliner Weisse. It is always used in conjunction with S.cerevisiae and often with various wild yeast. Use in beers below 10 IBU is recommended due to the culture’s sensitivity to hop compounds. ",9%,
yeast,WY5526 Wyeast Brettanomyces Lambicus,,,,Very High,60ºF – 75ºF,"This is a wild yeast strain isolated from Belgian lambic beers. It produces a pie cherry-like flavor and sourness along with distinct “Brett” character. A pellicle may form in bottles or casks. To produce the classic Belgian character, this strain works best in conjunction with other yeast and lactic bacteria. It generally requires 3-6 months of aging to fully develop flavor characteristics. ",12%,Medium
yeast,WY5609 Wyeast Greenbelt,,,,76,65ºF – 72ºF,"Greenbelt is an American ale strain that complements hop-driven beers with fruity and floral aromas.  Good attenuation and high flocculation characteristics make Greenbelt clean and versatile.  The name Greenbelt was chosen in honor of the Barton Creek Greenbelt, a popular stretch of public land in Austin, TX consisting of numerous hiking trails and natural swimming holes. ",10%,High
yeast,WY5733 Wyeast Pediococcus Cerevisiae,,,,,60ºF – 95ºF,Lactic acid bacteria used in the production of Belgian style beers where additional acidity is desirable. Often found in gueuze and other Belgian style beer. Acid production will increase with storage time. It may also cause “ropiness” and produce low levels of diacetyl with extended storage time. ,9%,
yeast,WY9093PC Wyeast Imperial Blend,,,,77.5,68ºF – 75ºF,"This unique blend of strains is designed to ferment higher gravity worts used in producing any style of Imperial beer. The results will be a rich, malty, full bodied beer with notes of citrus & fruity esters. Even with a high starting gravity your Imperials will have a relatively dry finish.  ",12% - 14%,Low – Medium
yeast,WY9097PC Wyeast Old Ale Blend,,,,77.5,68ºF – 75ºF,"To bring you a bit of English brewing heritage we developed the “Old Ale” blend. It includes an attenuative ale strain along with a small amount of Brettanomyces. The blend will ferment well in dark worts, producing fruity beers with nice complexity. The Brettanomyces adds a pie cherry-like flavor and sourness during prolonged aging.",12% - 14%,Medium